eus,eu_desc,hs6,hs6_lumped,resolve,phase2_status,cls,h,hdesc,inpanel
300040,Lupins/lupini beans,071331,LUMPED(2→071331),auto_hs6_present,needs_confirm,OK,071331,"Vegetables, leguminous: beans of the species vigna mungo (l.) hepper or vigna radiata (l.) wilczek, shelled, whether or not skinned or split, dried",True
252020,Purslanes,070930,LUMPED(3→070930),auto_hs6_present,needs_arbitration,LUMPING,070930,"Vegetables: aubergines, (e.g. plants), fresh or chilled",True
250000,"Leaf vegetables, herbs and edible flowers",,,needs_review,needs_review_group,NO_HS6,,,False
280020,Wild fungi,070960,LUMPED(3→070960),auto_hs6_present,needs_arbitration,LUMPING,070960,"Vegetables: fruits of the genus capsicum or of the genus pimenta, fresh or chilled",False
213060,Parsnips,070610,LUMPED(5→070610),auto_hs6_present,needs_confirm,LUMPING,070610,"Vegetables, root: carrots and turnips, fresh or chilled",True
211000,(a) potatoes,070110,,auto_hs6_present,needs_review_group,OK,070110,"Vegetables: seed potatoes, fresh or chilled",True
256050,Sage,070951,LUMPED(3→070951),auto_hs6_present,needs_confirm,LUMPING,070951,"Vegetables: mushrooms of the genus Agaricus, fresh or chilled",False
213030,Celeriacs/turnip rooted celeries,070610,LUMPED(5→070610),auto_hs6_present,needs_arbitration,OK,070610,"Vegetables, root: carrots and turnips, fresh or chilled",True
244000,(d) kohlrabies,070690,LUMPED(5→070690),auto_hs6_present,needs_review_group,catchall,070690,"Vegetables, root: salad beetroot, salsify, celeric, radishes and similar edible roots, fresh or chilled",True
830990,Others (2),090619,,auto_hs6_present,excluded_nec,OK,090619,"Spices: cinnamon and cinnamon-tree flowers, other than cinnamon (Cinnamomum zeylanicum Blume), neither crushed nor ground",True
270990,Others (2),070940,LUMPED(11→070940),auto_hs6_present,excluded_nec,OK,070940,"Vegetables: celery (other than celeriac), fresh or chilled",False
256070,Thyme,070940,LUMPED(11→070940),auto_hs6_present,needs_confirm,LUMPING,070940,"Vegetables: celery (other than celeriac), fresh or chilled",False
1050000,Amphibians and Reptiles,,,,needs_review_group,NO_HS6,,,False
256040,Parsley,070920,LUMPED(6→070920),auto_hs6_present,needs_arbitration,LUMPING,070920,"Vegetables: asparagus, fresh or chilled",False
163100,Durians,081060,,vn_finalized,verified_high,OK,081060,"Fruit, edible: durians, fresh",True
242020,Head cabbages,070410,LUMPED(8→070410),auto_hs6_present,needs_arbitration,OK,070410,"Vegetables, brassica: cauliflowers and headed broccoli, fresh or chilled",True
130050,Loquats/Japanese medlars,080830,LUMPED(4→080830),auto_hs6_present,needs_arbitration,LUMPING,080830,"Fruit, edible: pears, fresh",True
300000,PULSES,071310,LUMPED(3→071310),auto_hs6_present,needs_review_group,LUMPING,071310,"Vegetables, leguminous: peas (pisum sativum), shelled, whether or not skinned or split, dried",True
870000,Aril spices,090811,LUMPED(2→090811),auto_hs6_present,needs_review_group,OK,090811,"Spices: nutmeg, neither crushed nor ground",True
401050,Sunflower seeds,120600,,auto_sci_name,needs_review_noanchor,OK,120600,"Oil seeds: sunflower seeds, whether or not broken",True
110030,Lemons,080550,LUMPED(2→080550),vn_finalized,verified_high,OK,080550,"Fruit, edible: lemons (Citrus limon, Citrus limonum), limes (Citrus aurantifolia , Citrus latifolia), fresh or dried",True
1011040,Kidney,,,,needs_review_noanchor,NO_HS6,,,False
260010,Beans (with pods),070820,LUMPED(2→070820),auto_hs6_present,needs_confirm,OK,070820,"Vegetables, leguminous: beans (vigna spp., phaseolus spp.), shelled or unshelled, fresh or chilled",True
632010,Strawberry,121190,LUMPED(13→121190),auto_herbal_infusion,needs_review_noanchor,UMBRELLA/multi,121190,"Plants and parts (including seeds and fruits) n.e.c. in heading no. 1211, used primarily in perfumery, pharmacy or for insecticidal, fungicidal purposes: fresh or dried, whether or not cut, crushed or powdered",True
1012040,Kidney,,,,needs_review_noanchor,NO_HS6,,,False
810030,Celery,090921,LUMPED(7→090921),auto_hs6_present,needs_arbitration,LUMPING,090921,"Spices: coriander seeds, neither crushed nor ground",True
401070,Soyabeans,120190,,auto_sci_name,needs_review_noanchor,ERROR,120190,"Soya beans: other than seed, whether or not broken",True
300010,Beans,071331,LUMPED(2→071331),auto_verified,verified_high,OK,071331,"Vegetables, leguminous: beans of the species vigna mungo (l.) hepper or vigna radiata (l.) wilczek, shelled, whether or not skinned or split, dried",True
401080,Mustard seeds,120750,LUMPED(2→120750),auto_sci_name,needs_review_noanchor,OK,120750,"Oil seeds: mustard seeds, whether or not broken",True
130000,Pome fruits,080810,LUMPED(2→080810),auto_hs6_present,needs_review_group,OK,080810,"Fruit, edible: apples, fresh",True
154990,Others (2),081040,LUMPED(8→081040),auto_hs6_present,excluded_nec,OK,081040,"Fruit, edible: cranberries, bilberries and other fruits of the genus vaccinium, fresh",False
500990,Others (2),,,excluded_nec,excluded_nec,NO_HS6,,,False
254000,(d) watercresses,070930,LUMPED(3→070930),auto_hs6_present,needs_review_group,catchall,070930,"Vegetables: aubergines, (e.g. plants), fresh or chilled",True
401150,Castor beans,120730,LUMPED(2→120730),auto_sci_name,needs_review_noanchor,OK,120730,"Oil seeds: castor oil seeds, whether or not broken",True
800000,SPICES,,,needs_review,needs_review_group,NO_HS6,,,False
162060,American persimmons/Virginia kaki,081070,LUMPED(3→081070),auto_hs6_present,needs_arbitration,OK,081070,"Fruit, edible: persimmons, fresh",True
242010,Brussels sprouts,070420,LUMPED(2→070420),auto_verified,verified_high,OK,070420,"Vegetables, brassica: brussel sprouts, fresh or chilled",True
1014000,d) goat,,,,needs_review_group,NO_HS6,,,False
830000,Bark spices,090611,LUMPED(2→090611),auto_hs6_present,needs_review_group,OK,090611,"Spices: cinnamon (Cinnamomum zeylanicum Blume), neither crushed nor ground",True
401100,Pumpkin seeds,120799,LUMPED(2→120799),auto_sci_name,needs_review_noanchor,UMBRELLA/multi,120799,"Oil seeds and oleaginous fruits: n.e.c. in heading no. 1207, whether or not broken",True
163050,Granate apples/pomegranates,080390,LUMPED(4→080390),auto_hs6_present,needs_arbitration,LUMPING,080390,"Fruit, edible: bananas, other than plantains, fresh or dried",True
900020,Sugar canes,121293,,auto_sci_name,needs_review_noanchor,UMBRELLA/multi,121293,"Sugar cane: fit for human consumption, fresh, chilled, frozen or dried, whether or not ground",True
220990,Others (2),070390,LUMPED(2→070390),auto_hs6_present,excluded_nec,UMBRELLA/multi,070390,"Vegetables, alliaceous: leeks and other kinds n.e.c. in heading no. 0703, fresh or chilled",True
1020040,Horse,,,,needs_review_noanchor,NO_HS6,,,False
251070,Red mustards,070511,LUMPED(5→070511),auto_hs6_present,needs_arbitration,LUMPING,070511,"Vegetables: cabbage (head) lettuce (lactuca sativa), fresh or chilled",True
232020,Gherkins,070700,LUMPED(2→070700),auto_verified,verified_high,OK,070700,"Vegetables: cucumbers and gherkins, fresh or chilled",True
161010,Dates,080410,,auto_verified,verified_high,OK,080410,"Fruit, edible: dates, fresh or dried",True
632990,Others (2),,,excluded_nec,excluded_nec,NO_HS6,,,False
153020,Dewberries,081010,LUMPED(5→081010),auto_hs6_present,needs_confirm,LUMPING,081010,"Fruit, edible: strawberries, fresh",False
233010,Melons,080719,LUMPED(3→080719),auto_verified,verified_high,OK,080719,"Fruit, edible: melons, other than watermelons, fresh",True
212010,Cassava roots/manioc,071410,LUMPED(4→071410),auto_hs6_present,needs_confirm,OK,071410,"Vegetable roots and tubers: manioc (cassava), with high starch or inulin content, fresh, chilled, frozen or dried, whether or not sliced or in the form of pellets",True
500060,Rice,100610;100620;100630;100640,,vn_finalized,verified_high,UMBRELLA/multi,100610,Cereals: rice in the husk (paddy or rough),True
232030,Courgettes,070993,LUMPED(4→070993),auto_hs6_present,needs_arbitration,OK,070993,"Vegetables: pumpkins, squash and gourds (Cucurbita spp.), fresh or chilled",True
252990,Others (2),070940,LUMPED(11→070940),auto_hs6_present,excluded_nec,OK,070940,"Vegetables: celery (other than celeriac), fresh or chilled",False
1030000,Birds eggs,,,,needs_review_group,NO_HS6,,,False
1015030,Liver,,,,needs_review_noanchor,NO_HS6,,,False
1014050,Edible offals (other than liver and kidney),,,,needs_review_noanchor,NO_HS6,,,False
220040,Spring onions/green onions and Welsh onions,070310,LUMPED(4→070310),auto_hs6_present,needs_arbitration,OK,070310,"Vegetables, alliaceous: onions and shallots, fresh or chilled",True
243990,Others (2),070519,LUMPED(5→070519),auto_hs6_present,excluded_nec,OK,070519,"Vegetables: lettuce (lactuca sativa), (other than cabbage lettuce), fresh or chilled",True
230000,Fruiting vegetables,,,needs_review,needs_review_group,NO_HS6,,,False
1017030,Liver,,,,needs_review_noanchor,NO_HS6,,,False
213080,Radishes,070690,LUMPED(5→070690),auto_verified,verified_high,OK,070690,"Vegetables, root: salad beetroot, salsify, celeric, radishes and similar edible roots, fresh or chilled",True
1017010,Muscle,,,,needs_review_noanchor,NO_HS6,,,False
200000,"VEGETABLES, FRESH or FROZEN",,,needs_review,needs_review_group,NO_HS6,,,False
153990,Others (2),081040,LUMPED(8→081040),auto_hs6_present,excluded_nec,OK,081040,"Fruit, edible: cranberries, bilberries and other fruits of the genus vaccinium, fresh",False
401090,Cotton seeds,120721,,auto_sci_name,needs_review_noanchor,OK,120721,"Oil seeds: cotton seeds, seed, whether or not broken",True
1013050,Edible offals (other than liver and kidney),,,,needs_review_noanchor,NO_HS6,,,False
810060,Dill,090961,LUMPED(5→090961),auto_hs6_present,needs_arbitration,LUMPING,090961,"Spices: seeds of anise, badian, caraway or fennel: juniper berries, neither crushed nor ground",True
154060,Mulberries (black and white),081020,LUMPED(4→081020),auto_hs6_present,needs_confirm,OK,081020,"Fruit, edible: raspberries, blackberries, mulberries, and loganberries, fresh",False
1016990,Others (2),,,,excluded_nec,NO_HS6,,,False
402040,Kapok,080232,,auto_sci_name,needs_review_noanchor,ERROR,080232,"Nuts, edible: walnuts, fresh or dried, shelled",True
1010000,Commodities from,,,,needs_review_group,NO_HS6,,,False
1030030,Geese,,,,needs_review_noanchor,NO_HS6,,,False
810070,Fennel,090961,LUMPED(5→090961),auto_verified,verified_high,OK,090961,"Spices: seeds of anise, badian, caraway or fennel: juniper berries, neither crushed nor ground",True
631990,Others (2),,,excluded_nec,excluded_nec,NO_HS6,,,False
163110,Soursops/guanabanas,080390,LUMPED(4→080390),auto_hs6_present,needs_arbitration,LUMPING,080390,"Fruit, edible: bananas, other than plantains, fresh or dried",True
700000,HOPS,,,needs_review,needs_review_group,NO_HS6,,,False
151020,Wine grapes,080610,LUMPED(3→080610),auto_hs6_present,needs_confirm,OK,080610,"Fruit, edible: grapes, fresh",True
633010,Valerian,121190,LUMPED(13→121190),auto_herbal_infusion,needs_review_noanchor,UMBRELLA/multi,121190,"Plants and parts (including seeds and fruits) n.e.c. in heading no. 1211, used primarily in perfumery, pharmacy or for insecticidal, fungicidal purposes: fresh or dried, whether or not cut, crushed or powdered",True
1015010,Muscle,,,,needs_review_noanchor,NO_HS6,,,False
220010,Garlic,070320,,auto_verified,verified_high,OK,070320,"Vegetables, alliaceous: garlic, fresh or chilled",True
640000,Cocoa beans,,,needs_review,needs_review_group,NO_HS6,,,False
253000,(c) grape leaves and similar species,070970,LUMPED(7→070970),auto_hs6_present,needs_review_group,OK,070970,"Vegetables: spinach, New Zealand spinach and orache spinach (garden spinach), fresh or chilled",False
1012050,Edible offals (other than liver and kidney),,,,needs_review_noanchor,NO_HS6,,,False
401060,Rapeseeds/canola seeds,120740,,auto_sci_name,needs_review_noanchor,OK,120740,"Oil seeds: sesamum seeds, whether or not broken",True
1011990,Others (2),,,,excluded_nec,NO_HS6,,,False
1015050,Edible offals (other than liver and kidney),,,,needs_review_noanchor,NO_HS6,,,False
161000,(a) edible peel,080430,LUMPED(2→080430),auto_hs6_present,needs_review_group,OK,080430,"Fruit, edible: pineapples, fresh or dried",True
154010,Blueberries,081040,LUMPED(8→081040),auto_verified,verified_high,OK,081040,"Fruit, edible: cranberries, bilberries and other fruits of the genus vaccinium, fresh",False
401130,Gold of pleasure seeds,120750,LUMPED(2→120750),auto_sci_name,needs_review_noanchor,OK,120750,"Oil seeds: mustard seeds, whether or not broken",True
1013010,Muscle,,,,needs_review_noanchor,NO_HS6,,,False
1012010,Muscle,,,,needs_review_noanchor,NO_HS6,,,False
210000,Root and tuber vegetables,,,needs_review,needs_review_group,NO_HS6,,,False
810990,Others (2),090921,LUMPED(7→090921),auto_hs6_present,excluded_nec,catchall,090921,"Spices: coriander seeds, neither crushed nor ground",True
260000,Legume vegetables,070810,LUMPED(4→070810),auto_hs6_present,needs_review_group,OK,070810,"Vegetables, leguminous: peas (pisum sativum), shelled or unshelled, fresh or chilled",True
151010,Table grapes,080610,LUMPED(3→080610),auto_verified,verified_high,OK,080610,"Fruit, edible: grapes, fresh",True
241000,(a) flowering brassica,070410,LUMPED(8→070410),auto_hs6_present,needs_review_group,OK,070410,"Vegetables, brassica: cauliflowers and headed broccoli, fresh or chilled",True
251020,Lettuces,070511,LUMPED(5→070511),auto_verified,verified_high,OK,070511,"Vegetables: cabbage (head) lettuce (lactuca sativa), fresh or chilled",True
610000,Teas,090210;090220;090230;090240,,vn_finalized,needs_review_group,UMBRELLA/multi,090210,"Tea, green: (not fermented), in immediate packings of a content not exceeding 3kg",True
241990,Others (2),070410,LUMPED(8→070410),auto_hs6_present,excluded_nec,catchall,070410,"Vegetables, brassica: cauliflowers and headed broccoli, fresh or chilled",True
161040,Kumquats,081030,LUMPED(5→081030),auto_hs6_present,needs_arbitration,LUMPING,081030,"Fruit, edible: black, white or red currants and gooseberries, fresh",False
212990,Others (2),071410,LUMPED(4→071410),auto_hs6_present,excluded_nec,catchall,071410,"Vegetable roots and tubers: manioc (cassava), with high starch or inulin content, fresh, chilled, frozen or dried, whether or not sliced or in the form of pellets",True
140040,Plums,080940,LUMPED(2→080940),auto_verified,verified_high,OK,080940,"Fruit, edible: plums and sloes, fresh",True
1013990,Others (2),,,,excluded_nec,NO_HS6,,,False
242000,(b) head brassica,070410,LUMPED(8→070410),auto_hs6_present,needs_review_group,OK,070410,"Vegetables, brassica: cauliflowers and headed broccoli, fresh or chilled",True
1015000,(e) equine,,,,needs_review_group,NO_HS6,,,False
900990,Others (2),,,excluded_nec,excluded_nec,NO_HS6,,,False
1011020,Fat,,,,needs_review_noanchor,NO_HS6,,,False
233000,(c) cucurbits with inedible peel,080719,LUMPED(3→080719),auto_hs6_present,needs_review_group,catchall,080719,"Fruit, edible: melons, other than watermelons, fresh",True
500040,Common milletproso millet,100821,,auto_hs6_present,needs_confirm,OK,100821,"Cereals: millet, seed",True
1020030,Goat,,,,needs_review_noanchor,NO_HS6,,,False
401030,Poppy seeds,120510,,auto_sci_name,needs_review_noanchor,OK,120510,"Oil seeds: low erucic acid rape or colza seeds, whether or not broken",True
1011030,Liver,,,,needs_review_noanchor,NO_HS6,,,False
1014040,Kidney,,,,needs_review_noanchor,NO_HS6,,,False
220000,Bulb vegetables,070310,LUMPED(4→070310),auto_hs6_present,needs_review_group,OK,070310,"Vegetables, alliaceous: onions and shallots, fresh or chilled",True
850010,Cloves,090710,LUMPED(4→090710),auto_verified,verified_high,OK,090710,"Spices: cloves (whole fruit, cloves and stems), neither crushed nor ground",True
256010,Chervil,070920,LUMPED(6→070920),auto_hs6_present,needs_arbitration,LUMPING,070920,"Vegetables: asparagus, fresh or chilled",False
633990,Others (2),,,excluded_nec,excluded_nec,NO_HS6,,,False
500090,Wheat,100111; 100119; 100191; 100199,,auto_verified,verified_high,UMBRELLA/multi,100111,"Cereals: wheat and meslin, durum wheat, seed",True
402030,Oil palms fruits,071120,LUMPED(2→071120),auto_sci_name,needs_review_noanchor,UMBRELLA/multi,071120,"Vegetables: olives, provisionally preserved but unsuitable in that state for immediate consumption",True
163070,Guavas,080450,LUMPED(2→080450),auto_verified,verified_high,OK,080450,"Fruit, edible: guavas, mangoes and mangosteens, fresh or dried",True
153030,Raspberries (red and yellow),081020,LUMPED(4→081020),auto_hs6_present,needs_confirm,OK,081020,"Fruit, edible: raspberries, blackberries, mulberries, and loganberries, fresh",False
810000,Seed spices,090921,LUMPED(7→090921),auto_hs6_present,needs_review_group,OK,090921,"Spices: coriander seeds, neither crushed nor ground",True
231040,Okralady's fingers,070999,LUMPED(2→070999),vn_finalized,needs_arbitration,UMBRELLA/multi,070999,"Vegetables: edible, n.e.c. in chapter 07, fresh or chilled",False
256080,Basil and edible flowers,070960,LUMPED(3→070960),auto_hs6_present,needs_arbitration,LUMPING,070960,"Vegetables: fruits of the genus capsicum or of the genus pimenta, fresh or chilled",False
162020,Litchislychees,081090,LUMPED(6→081090),vn_finalized,needs_arbitration,UMBRELLA/multi,081090,"Fruit, edible: fruits n.e.c. in heading no. 0801 to 0810, fresh",True
154050,Rose hips,081010,LUMPED(5→081010),auto_hs6_present,needs_arbitration,LUMPING,081010,"Fruit, edible: strawberries, fresh",False
260030,Peas (with pods),070810,LUMPED(4→070810),auto_verified,verified_high,OK,070810,"Vegetables, leguminous: peas (pisum sativum), shelled or unshelled, fresh or chilled",True
232990,Others (2),070940,LUMPED(11→070940),auto_hs6_present,excluded_nec,OK,070940,"Vegetables: celery (other than celeriac), fresh or chilled",False
1200000,PRODUCTS OR PART OF PRODUCTS EXCLUSIVELY USED FOR ANIMAL FEED PRODUCTION (8),,,,needs_review_group,NO_HS6,,,False
233990,Others (2),080719,LUMPED(3→080719),auto_hs6_present,excluded_nec,OK,080719,"Fruit, edible: melons, other than watermelons, fresh",True
280990,Mosses and lichens,070959,LUMPED(2→070959),auto_hs6_present,needs_arbitration,OK,070959,"Vegetables: truffles and mushrooms (other than of the genus Agaricus), fresh or chilled",True
402020,Oil palms kernels,120710,,auto_sci_name,needs_review_noanchor,OK,120710,"Oil seeds: palm nuts and kernels, whether or not broken",False
260990,Others (2),070890,,auto_hs6_present,excluded_nec,OK,070890,"Vegetables, leguminous: (other than peas and beans), shelled or unshelled, fresh or chilled",True
140010,Apricots,080910,,auto_verified,verified_high,OK,080910,"Fruit, edible: apricots, fresh",True
632020,Rooibos,121190,LUMPED(13→121190),auto_herbal_infusion,needs_review_noanchor,UMBRELLA/multi,121190,"Plants and parts (including seeds and fruits) n.e.c. in heading no. 1211, used primarily in perfumery, pharmacy or for insecticidal, fungicidal purposes: fresh or dried, whether or not cut, crushed or powdered",True
154070,AzarolesMediterranean medlars,081030,LUMPED(5→081030),auto_hs6_present,needs_arbitration,LUMPING,081030,"Fruit, edible: black, white or red currants and gooseberries, fresh",False
110020,Oranges,080510,LUMPED(2→080510),vn_finalized,verified_high,OK,080510,"Fruit, edible: oranges, fresh or dried",True
840040,Horseradish (11),091091,,auto_hs6_present,needs_arbitration,ERROR,091091,Spices: mixtures of 2 or more products of different headings,True
870010,Mace,090821,LUMPED(2→090821),auto_verified,verified_high,OK,090821,"Spices: mace, neither crushed nor ground",True
1014030,Liver,,,,needs_review_noanchor,NO_HS6,,,False
820010,Allspicepimento,090421,LUMPED(2→090421),auto_hs6_present,needs_confirm,OK,090421,"Spices: fruits of the genus Capsicum or Pimenta, dried, neither crushed nor ground",False
260050,Lentils,070810,LUMPED(4→070810),auto_hs6_present,needs_arbitration,LUMPING,070810,"Vegetables, leguminous: peas (pisum sativum), shelled or unshelled, fresh or chilled",True
243010,Chinese cabbagespe-tsai,070420,LUMPED(2→070420),auto_hs6_present,needs_arbitration,OK,070420,"Vegetables, brassica: brussel sprouts, fresh or chilled",True
401990,Others (2),,,excluded_nec,excluded_nec,NO_HS6,,,False
231010,Tomatoes,070200,,auto_verified,verified_high,OK,070200,"Vegetables: tomatoes, fresh or chilled",True
820080,Tamarind,090421,LUMPED(2→090421),auto_hs6_present,needs_confirm,LUMPING,090421,"Spices: fruits of the genus Capsicum or Pimenta, dried, neither crushed nor ground",False
1020010,Cattle,,,,needs_review_noanchor,NO_HS6,,,False
631030,Rose,121190,LUMPED(13→121190),auto_herbal_infusion,needs_review_noanchor,UMBRELLA/multi,121190,"Plants and parts (including seeds and fruits) n.e.c. in heading no. 1211, used primarily in perfumery, pharmacy or for insecticidal, fungicidal purposes: fresh or dried, whether or not cut, crushed or powdered",True
900010,Sugar beet roots,121291,,auto_sci_name,needs_review_noanchor,UMBRELLA/multi,121291,"Sugar beet: fit for human consumption, fresh, chilled, frozen or dried, whether or not ground",True
850020,Capers,090710,LUMPED(4→090710),auto_hs6_present,needs_arbitration,LUMPING,090710,"Spices: cloves (whole fruit, cloves and stems), neither crushed nor ground",True
820020,Sichuan pepper,090411,LUMPED(4→090411),auto_hs6_present,needs_confirm,OK,090411,"Spices: pepper (of the genus piper), neither crushed nor ground",True
631040,Jasmine,121190,LUMPED(13→121190),auto_herbal_infusion,needs_review_noanchor,UMBRELLA/multi,121190,"Plants and parts (including seeds and fruits) n.e.c. in heading no. 1211, used primarily in perfumery, pharmacy or for insecticidal, fungicidal purposes: fresh or dried, whether or not cut, crushed or powdered",True
212020,Sweet potatoes,071420,LUMPED(2→071420),auto_verified,verified_high,OK,071420,"Vegetable roots and tubers: sweet potatoes, with high starch or inulin content, fresh, chilled, frozen or dried, whether or not sliced or in the form of pellets",True
163020,Bananas,080390,LUMPED(4→080390),auto_verified,verified_high,OK,080390,"Fruit, edible: bananas, other than plantains, fresh or dried",True
270090,Palm hearts,070959,LUMPED(2→070959),auto_hs6_present,needs_arbitration,LUMPING,070959,"Vegetables: truffles and mushrooms (other than of the genus Agaricus), fresh or chilled",True
1000000,PRODUCTS OF ANIMAL ORIGIN -TERRESTRIAL ANIMALS,,,,needs_review_group,NO_HS6,,,False
1017020,Fat,,,,needs_review_noanchor,NO_HS6,,,False
401140,Hemp seeds,120799,LUMPED(2→120799),auto_sci_name,needs_review_noanchor,UMBRELLA/multi,120799,"Oil seeds and oleaginous fruits: n.e.c. in heading no. 1207, whether or not broken",True
154030,"Currants (black, red and white)",081030,LUMPED(5→081030),auto_verified,verified_high,OK,081030,"Fruit, edible: black, white or red currants and gooseberries, fresh",False
110000,Citrus fruits,080590,,auto_hs6_present,needs_review_group,UMBRELLA/multi,080590,"Fruit, edible: citrus fruit n.e.c. in heading no. 0805, fresh or dried",True
1030040,Quail,,,,needs_review_noanchor,NO_HS6,,,False
251010,Lamb's lettucescorn salads,070519,LUMPED(5→070519),auto_hs6_present,needs_arbitration,LUMPING,070519,"Vegetables: lettuce (lactuca sativa), (other than cabbage lettuce), fresh or chilled",True
500070,Rye,100210,,auto_verified,verified_high,OK,100210,"Cereals: rye, seed",True
213100,Swedesrutabagas,071410,LUMPED(4→071410),auto_hs6_present,needs_arbitration,LUMPING,071410,"Vegetable roots and tubers: manioc (cassava), with high starch or inulin content, fresh, chilled, frozen or dried, whether or not sliced or in the form of pellets",True
251080,Baby leaf crops (including brassica species),070519,LUMPED(5→070519),auto_hs6_present,needs_arbitration,LUMPING,070519,"Vegetables: lettuce (lactuca sativa), (other than cabbage lettuce), fresh or chilled",True
252010,Spinaches,070970,LUMPED(7→070970),auto_verified,verified_high,LUMPING,070970,"Vegetables: spinach, New Zealand spinach and orache spinach (garden spinach), fresh or chilled",False
256060,Rosemary,070940,LUMPED(11→070940),auto_hs6_present,needs_arbitration,LUMPING,070940,"Vegetables: celery (other than celeriac), fresh or chilled",False
120050,Coconuts,080111,,auto_verified,verified_high,OK,080111,"Nuts, edible: coconuts, desiccated",True
120110,Walnuts,080231,,auto_verified,verified_high,OK,080231,"Nuts, edible: walnuts, fresh or dried, in shell",True
830010,Cinnamon,090611,LUMPED(2→090611),auto_verified,verified_high,OK,090611,"Spices: cinnamon (Cinnamomum zeylanicum Blume), neither crushed nor ground",True
1016050,Edible offals (other than liver and kidney),,,,needs_review_noanchor,NO_HS6,,,False
1016030,Liver,,,,needs_review_noanchor,NO_HS6,,,False
163040,Papayas,080720,,auto_verified,verified_high,OK,080720,"Fruit, edible: papaws (papayas), fresh",True
163010,Avocados,080440,,auto_verified,verified_high,OK,080440,"Fruit, edible: avocados, fresh or dried",True
163000,"(c) inedible peel, large",080310,,auto_hs6_present,needs_review_group,catchall,080310,"Fruit, edible: plantains, fresh or dried",True
270050,Globe artichokes,070991,,auto_verified,verified_high,OK,070991,"Vegetables: globe artichokes, fresh or chilled",True
1012030,Liver,,,,needs_review_noanchor,NO_HS6,,,False
500050,Oat,100410,,auto_verified,verified_high,OK,100410,"Cereals: oats, seeds",True
1300000,PROCESSED FOOD PRODUCTS (9),,,,needs_review_group,NO_HS6,,,False
810040,Coriander,090921,LUMPED(7→090921),auto_verified,verified_high,OK,090921,"Spices: coriander seeds, neither crushed nor ground",True
231020,Sweet peppersbell peppers,070960;090421;090422,,vn_finalized,needs_arbitration,UMBRELLA/multi,070960,"Vegetables: fruits of the genus capsicum or of the genus pimenta, fresh or chilled",False
1100000,"PRODUCTS OF ANIMAL ORIGIN - FISH, FISHPRODUCTS AND ANY OTHER MARINE AND FRESHWATER FOOD PRODUCTS (8)",,,,needs_review_group,NO_HS6,,,False
500000,CEREALS,,,needs_review,needs_review_group,NO_HS6,,,False
