eus,eu_desc,hs6,hs6_lumped,resolve,phase2_status,cls,h,hdesc,inpanel
631000,(a) flowers,121190,LUMPED(13→121190),auto_herbal_infusion,needs_review_group,UMBRELLA/multi,121190,"Plants and parts (including seeds and fruits) n.e.c. in heading no. 1211, used primarily in perfumery, pharmacy or for insecticidal, fungicidal purposes: fresh or dried, whether or not cut, crushed or powdered",True
130020,Pears,080830,LUMPED(4→080830),auto_verified,verified_high,OK,080830,"Fruit, edible: pears, fresh",True
161990,Others (2),081040,LUMPED(8→081040),auto_hs6_present,excluded_nec,OK,081040,"Fruit, edible: cranberries, bilberries and other fruits of the genus vaccinium, fresh",False
232000,(b) cucurbits with edible peel,070993,LUMPED(4→070993),auto_hs6_present,needs_review_group,catchall,070993,"Vegetables: pumpkins, squash and gourds (Cucurbita spp.), fresh or chilled",True
120060,Hazelnuts/cobnuts,080221,,auto_verified,verified_high,OK,080221,"Nuts, edible: hazelnuts or filberts (corylus spp.), fresh or dried, in shell",True
870990,Others (2),090811,LUMPED(2→090811),auto_hs6_present,excluded_nec,catchall,090811,"Spices: nutmeg, neither crushed nor ground",True
280010,Cultivated fungi,070960,LUMPED(3→070960),auto_hs6_present,needs_arbitration,LUMPING,070960,"Vegetables: fruits of the genus capsicum or of the genus pimenta, fresh or chilled",False
1017990,Others (2),,,,excluded_nec,NO_HS6,,,False
251060,Roman rocket/rucola,070511,LUMPED(5→070511),auto_hs6_present,needs_arbitration,OK,070511,"Vegetables: cabbage (head) lettuce (lactuca sativa), fresh or chilled",True
1016020,Fat,,,,needs_review_noanchor,NO_HS6,,,False
213020,Carrots,070610,LUMPED(5→070610),auto_verified,verified_high,OK,070610,"Vegetables, root: carrots and turnips, fresh or chilled",True
120080,Pecans,080131,LUMPED(2→080131),auto_hs6_present,needs_confirm,LUMPING,080131,"Nuts, edible: cashew nuts, fresh or dried, in shell",True
1014020,Fat,,,,needs_review_noanchor,NO_HS6,,,False
163990,Others (2),080390,LUMPED(4→080390),auto_hs6_present,excluded_nec,OK,080390,"Fruit, edible: bananas, other than plantains, fresh or dried",True
300030,Peas,071310,LUMPED(3→071310),auto_verified,verified_high,OK,071310,"Vegetables, leguminous: peas (pisum sativum), shelled, whether or not skinned or split, dried",True
400000,OILSEEDS AND OIL FRUITS,,,needs_review,needs_review_group,NO_HS6,,,False
161060,Kaki/Japanese persimmons,081070,LUMPED(3→081070),auto_hs6_present,needs_confirm,OK,081070,"Fruit, edible: persimmons, fresh",True
154000,(d) other small fruits and berries,081040,LUMPED(8→081040),auto_hs6_present,needs_review_group,OK,081040,"Fruit, edible: cranberries, bilberries and other fruits of the genus vaccinium, fresh",False
151000,(a) grapes,080610,LUMPED(3→080610),auto_hs6_present,needs_review_group,OK,080610,"Fruit, edible: grapes, fresh",True
163030,Mangoes,080450,LUMPED(2→080450),vn_finalized,verified_high,OK,080450,"Fruit, edible: guavas, mangoes and mangosteens, fresh or dried",True
120010,Almonds,080211,,auto_verified,verified_high,OK,080211,"Nuts, edible: almonds, fresh or dried, in shell",True
840010,Liquorice,091030,LUMPED(2→091030),auto_hs6_present,needs_arbitration,LUMPING,091030,Spices: turmeric (curcuma),True
1060000,Terrestrial invertebrate animals,,,,needs_review_group,NO_HS6,,,False
401120,Borage seeds,120760,,auto_sci_name,needs_review_noanchor,OK,120760,"Oil seeds: safflower (Carthamus tinctorius) seeds, whether or not broken",True
